{
  "catalog_version": "0.1.0",
  "generated_at": "2026-09-04T02:42:07Z",
  "sources": [
    {
      "name": "rocm-gpu-specs",
      "url": "https://github.com/ROCm/ROCm/blob/develop/docs/reference/gpu-specs.rst",
      "ref": "7c4741029cf8bb53c71449ac110744a91e90c445"
    },
    {
      "name": "rocm-precision-support",
      "url": "https://github.com/ROCm/ROCm/blob/develop/docs/reference/precision-support.rst",
      "ref": "245d7ceaad0e670ab3fcc5601a690ecaad0a003d"
    },
    {
      "name": "libdrm-amdgpu-ids",
      "url": "https://gitlab.freedesktop.org/mesa/libdrm/-/blob/main/data/amdgpu.ids",
      "ref": "15cdcfe9e1c4b00f2a819bc1f4b3efa1326ac6bc"
    },
    {
      "name": "llvm-amdgpu-usage",
      "url": "https://github.com/llvm/llvm-project/blob/main/llvm/docs/AMDGPUUsage.rst",
      "ref": "012ea2319f73fc24c1614f8c8868c26de6d58ce9"
    },
    {
      "name": "xdna-driver-npu-pciids",
      "url": "https://github.com/amd/xdna-driver/blob/main/drivers/accel/amdxdna",
      "ref": "7f51e921ce5ea13c9489fcd1bc4938b974174a8a"
    }
  ],
  "gpus": [
    {
      "specs": {
        "vram_gib": 288,
        "compute_units": "256 (32 per XCD)",
        "wavefront_size": 64,
        "lds_kib": 160,
        "l3_cache_mib": 256,
        "l2_cache_mib": "32 (4 per XCD)",
        "l1_vector_cache_kib": 32,
        "l1_scalar_cache_kib": "16 per 2 CUs",
        "l1_instruction_cache_kib": "64 per 2 CUs",
        "vgpr_file_kib": 512,
        "sgpr_file_kib": 12.5,
        "gfxip_major_version": 9,
        "gfxip_minor_version": 5,
        "gfxip_stepping_version": "0"
      },
      "product_name": "MI355X",
      "generation": "CDNA4",
      "gfx_target": "gfx950",
      "memory_model": "dedicated",
      "lifecycle_status": "unknown",
      "device_id": "75a3",
      "precision_support": {
        "int8": true,
        "int16": true,
        "int32": true,
        "int64": true,
        "fp4_e2m1": true,
        "fp6_e2m3": true,
        "fp6_e3m2": true,
        "fp8_e4m3_fnuz": false,
        "fp8_e5m2_fnuz": false,
        "fp8_e4m3": true,
        "fp8_e5m2": true,
        "float16": true,
        "bfloat16": true,
        "float32": true,
        "float64": true
      }
    },
    {
      "specs": {
        "vram_gib": 288,
        "compute_units": "256 (32 per XCD)",
        "wavefront_size": 64,
        "lds_kib": 160,
        "l3_cache_mib": 256,
        "l2_cache_mib": "32 (4 per XCD)",
        "l1_vector_cache_kib": 32,
        "l1_scalar_cache_kib": "16 per 2 CUs",
        "l1_instruction_cache_kib": "64 per 2 CUs",
        "vgpr_file_kib": 512,
        "sgpr_file_kib": 12.5,
        "gfxip_major_version": 9,
        "gfxip_minor_version": 5,
        "gfxip_stepping_version": "0"
      },
      "product_name": "MI350X",
      "generation": "CDNA4",
      "gfx_target": "gfx950",
      "memory_model": "dedicated",
      "lifecycle_status": "unknown",
      "device_id": "75a0",
      "precision_support": {
        "int8": true,
        "int16": true,
        "int32": true,
        "int64": true,
        "fp4_e2m1": true,
        "fp6_e2m3": true,
        "fp6_e3m2": true,
        "fp8_e4m3_fnuz": false,
        "fp8_e5m2_fnuz": false,
        "fp8_e4m3": true,
        "fp8_e5m2": true,
        "float16": true,
        "bfloat16": true,
        "float32": true,
        "float64": true
      }
    },
    {
      "specs": {
        "vram_gib": 256,
        "compute_units": "304 (38 per XCD)",
        "wavefront_size": 64,
        "lds_kib": 64,
        "l3_cache_mib": 256,
        "l2_cache_mib": "32 (4 per XCD)",
        "l1_vector_cache_kib": 32,
        "l1_scalar_cache_kib": "16 per 2 CUs",
        "l1_instruction_cache_kib": "64 per 2 CUs",
        "vgpr_file_kib": 512,
        "sgpr_file_kib": 12.5,
        "gfxip_major_version": 9,
        "gfxip_minor_version": 4,
        "gfxip_stepping_version": "2"
      },
      "product_name": "MI325X",
      "generation": "CDNA3",
      "gfx_target": "gfx942",
      "memory_model": "dedicated",
      "lifecycle_status": "unknown",
      "device_id": "74a5",
      "precision_support": {
        "int8": true,
        "int16": true,
        "int32": true,
        "int64": true,
        "fp4_e2m1": false,
        "fp6_e2m3": false,
        "fp6_e3m2": false,
        "fp8_e4m3_fnuz": true,
        "fp8_e5m2_fnuz": true,
        "fp8_e4m3": false,
        "fp8_e5m2": false,
        "float16": true,
        "bfloat16": true,
        "float32": true,
        "float64": true
      }
    },
    {
      "specs": {
        "vram_gib": 192,
        "compute_units": "304 (38 per XCD)",
        "wavefront_size": 64,
        "lds_kib": 64,
        "l3_cache_mib": 256,
        "l2_cache_mib": "32 (4 per XCD)",
        "l1_vector_cache_kib": 32,
        "l1_scalar_cache_kib": "16 per 2 CUs",
        "l1_instruction_cache_kib": "64 per 2 CUs",
        "vgpr_file_kib": 512,
        "sgpr_file_kib": 12.5,
        "gfxip_major_version": 9,
        "gfxip_minor_version": 4,
        "gfxip_stepping_version": "2"
      },
      "product_name": "MI300X",
      "generation": "CDNA3",
      "gfx_target": "gfx942",
      "memory_model": "dedicated",
      "lifecycle_status": "unknown",
      "device_id": "74a1",
      "precision_support": {
        "int8": true,
        "int16": true,
        "int32": true,
        "int64": true,
        "fp4_e2m1": false,
        "fp6_e2m3": false,
        "fp6_e3m2": false,
        "fp8_e4m3_fnuz": true,
        "fp8_e5m2_fnuz": true,
        "fp8_e4m3": false,
        "fp8_e5m2": false,
        "float16": true,
        "bfloat16": true,
        "float32": true,
        "float64": true
      }
    },
    {
      "specs": {
        "vram_gib": 128,
        "compute_units": "228 (38 per XCD)",
        "wavefront_size": 64,
        "lds_kib": 64,
        "l3_cache_mib": 256,
        "l2_cache_mib": "24 (4 per XCD)",
        "l1_vector_cache_kib": 32,
        "l1_scalar_cache_kib": "16 per 2 CUs",
        "l1_instruction_cache_kib": "64 per 2 CUs",
        "vgpr_file_kib": 512,
        "sgpr_file_kib": 12.5,
        "gfxip_major_version": 9,
        "gfxip_minor_version": 4,
        "gfxip_stepping_version": "2"
      },
      "product_name": "MI300A",
      "generation": "CDNA3",
      "gfx_target": "gfx942",
      "memory_model": "dedicated",
      "lifecycle_status": "unknown",
      "device_id": "74a0",
      "precision_support": {
        "int8": true,
        "int16": true,
        "int32": true,
        "int64": true,
        "fp4_e2m1": false,
        "fp6_e2m3": false,
        "fp6_e3m2": false,
        "fp8_e4m3_fnuz": true,
        "fp8_e5m2_fnuz": true,
        "fp8_e4m3": false,
        "fp8_e5m2": false,
        "float16": true,
        "bfloat16": true,
        "float32": true,
        "float64": true
      }
    },
    {
      "specs": {
        "vram_gib": 128,
        "compute_units": "220 (110 per GCD)",
        "wavefront_size": 64,
        "lds_kib": 64,
        "l3_cache_mib": "",
        "l2_cache_mib": "16 (8 per GCD)",
        "l1_vector_cache_kib": 16,
        "l1_scalar_cache_kib": "16 per 2 CUs",
        "l1_instruction_cache_kib": "32 per 2 CUs",
        "vgpr_file_kib": 512,
        "sgpr_file_kib": 12.5,
        "gfxip_major_version": 9,
        "gfxip_minor_version": 0,
        "gfxip_stepping_version": "a"
      },
      "product_name": "MI250X",
      "generation": "CDNA2",
      "gfx_target": "gfx90a",
      "memory_model": "dedicated",
      "lifecycle_status": "unknown",
      "precision_support": {
        "int8": true,
        "int16": true,
        "int32": true,
        "int64": true,
        "fp4_e2m1": false,
        "fp6_e2m3": false,
        "fp6_e3m2": false,
        "fp8_e4m3_fnuz": false,
        "fp8_e5m2_fnuz": false,
        "fp8_e4m3": false,
        "fp8_e5m2": false,
        "float16": true,
        "bfloat16": true,
        "float32": true,
        "float64": true
      }
    },
    {
      "specs": {
        "vram_gib": 128,
        "compute_units": "208 (104 per GCD)",
        "wavefront_size": 64,
        "lds_kib": 64,
        "l3_cache_mib": "",
        "l2_cache_mib": "16 (8 per GCD)",
        "l1_vector_cache_kib": 16,
        "l1_scalar_cache_kib": "16 per 2 CUs",
        "l1_instruction_cache_kib": "32 per 2 CUs",
        "vgpr_file_kib": 512,
        "sgpr_file_kib": 12.5,
        "gfxip_major_version": 9,
        "gfxip_minor_version": 0,
        "gfxip_stepping_version": "a"
      },
      "product_name": "MI250",
      "generation": "CDNA2",
      "gfx_target": "gfx90a",
      "memory_model": "dedicated",
      "lifecycle_status": "unknown",
      "device_id": "740c",
      "precision_support": {
        "int8": true,
        "int16": true,
        "int32": true,
        "int64": true,
        "fp4_e2m1": false,
        "fp6_e2m3": false,
        "fp6_e3m2": false,
        "fp8_e4m3_fnuz": false,
        "fp8_e5m2_fnuz": false,
        "fp8_e4m3": false,
        "fp8_e5m2": false,
        "float16": true,
        "bfloat16": true,
        "float32": true,
        "float64": true
      }
    },
    {
      "specs": {
        "vram_gib": 64,
        "compute_units": 104,
        "wavefront_size": 64,
        "lds_kib": 64,
        "l3_cache_mib": "",
        "l2_cache_mib": 8,
        "l1_vector_cache_kib": 16,
        "l1_scalar_cache_kib": "16 per 2 CUs",
        "l1_instruction_cache_kib": "32 per 2 CUs",
        "vgpr_file_kib": 512,
        "sgpr_file_kib": 12.5,
        "gfxip_major_version": 9,
        "gfxip_minor_version": 0,
        "gfxip_stepping_version": "a"
      },
      "product_name": "MI210",
      "generation": "CDNA2",
      "gfx_target": "gfx90a",
      "memory_model": "dedicated",
      "lifecycle_status": "unknown",
      "device_id": "740f",
      "precision_support": {
        "int8": true,
        "int16": true,
        "int32": true,
        "int64": true,
        "fp4_e2m1": false,
        "fp6_e2m3": false,
        "fp6_e3m2": false,